id,titre,description,service,date
1,Problème d'équipement,Le scanner ne fonctionne pas correctement,Service de Radiologie,2023-11-30
2,Erreur de dosage,Erreur de dosage dans la prescription médicale,Service de Pharmacie,2023-11-30
3,Panne d'électricité,Perte de courant dans l'aile est de l'hôpital,Service des Installations,2023-11-30
4,Accident de glissement,Chute dans le hall d'entrée,Service des Urgences,2023-11-30
5,Infection nosocomiale,Cas d'infection nosocomiale identifié,Service d'Hygiène,2023-11-30
6,Problème d'équipement,Le scanner ne fonctionne pas correctement,Service de Radiologie,2024-11-30
7,Erreur de dosage,Erreur de dosage dans la prescription médicale,Service de Pharmacie,2024-11-30
8,Infection nosocomiale,Cas d'infection nosocomiale identifié,Service d'Hygiène,2024-11-30
